{
  "id": "trapeze",
  "name": "Trapeze",
  "parentClass": "acrobat",
  "source": "Circus System",
  "flavor": "The purest expression of the Acrobat's aerial fantasy: a performer who treats open air as solid ground, closing distance, escaping danger, and pulling allies along for the ride on lines only they can see.",
  "features": [
    {
      "level": 3,
      "name": "Aerial Anchor",
      "description": "Your mastery of the trapeze frees you from needing real rigging. You can use Trapeze Swing at any time, even when no rope, chandelier, banner, or similar structure is within reach, treating open air as your line. Additionally, when you use Trapeze Swing, you may bring one willing or incapacitated Medium or smaller creature within 5 feet of you along the swing; that creature moves with you at no cost to your own movement and does not provoke opportunity attacks during the swing. Trapeze Swing remains a signature move when used this way, so it still generates Momentum.",
      "meta": {
        "action": "Passive (enhances Trapeze Swing)"
      }
    },
    {
      "level": 3,
      "name": "Featherweight Landing",
      "description": "Your body has learned to always find purchase. You take no damage from a fall of 30 feet or less, and for any longer fall you calculate damage as though you had fallen 30 feet less than you actually did. In addition, whenever you fall or would be knocked prone as a result of your own fall or your own signature move (such as a failed Wall-Run or Trapeze Swing), you can spend 1 Momentum (no action required) to land on your feet instead, ending the fall without becoming prone, provided you end it in a space you could normally occupy. This does not apply to being knocked prone or forcibly moved by a hostile creature's attack, spell, or ability.",
      "meta": {
        "action": "Passive",
        "cost": "1 Momentum (land on feet)"
      }
    },
    {
      "level": 5,
      "name": "Intercepting Swing",
      "description": "Your lines reach anywhere you can see. When a creature you can see within 30 feet of you hits an ally with an attack, you can use your reaction to drop onto a line out of nowhere and swing to an unoccupied space within 5 feet of that attacker, then make one melee weapon attack against it — punishing the opening the instant it commits. As with Trapeze Swing, this aerial style is flashy, not safe: leaving a creature's reach as you swing provokes opportunity attacks as normal. This does not count as your Trapeze Swing for the turn and generates no Momentum. It uses the same single reaction as Parry, so on a turn when Flowing Reflexes (4th level) returns your reaction after a clean Parry, you can both defend yourself and swing to a struck ally's aid in the same round.",
      "meta": {
        "action": "Reaction",
        "uses": "1 / round",
        "range": "30 ft"
      }
    }
  ]
}