{
  "id": "harlequin",
  "name": "Harlequin",
  "parentClass": "joker",
  "source": "Circus System",
  "flavor": "The maddest act under the big top: a Joker who stops treating melee as something to avoid and starts treating a ring full of enemies as the best possible stage, grinning wider the closer the danger gets.",
  "features": [
    {
      "level": 3,
      "name": "Reckless Grin",
      "description": "As a bonus action, spend 1 Mayhem to throw caution to the wind until the start of your next turn: you have advantage on melee attack rolls you make with a finesse weapon you're proficient with, but attack rolls against you also have advantage until the start of your next turn. You can only be under the effect of Reckless Grin once at a time; using it again while it is already active changes nothing and doesn't cost additional Mayhem.",
      "meta": {
        "action": "Bonus Action",
        "cost": "1 Mayhem",
        "range": "Self"
      }
    },
    {
      "level": 3,
      "name": "Center of the Ring",
      "description": "You thrive surrounded by danger. At the start of your turn, if you are within 5 feet of at least two hostile creatures, you gain temporary hit points equal to your Charisma modifier (minimum 1), and for the rest of the turn moving through a space occupied by a hostile creature costs you no extra movement (you still can't end your movement there). As with temporary hit points from any other source, these don't stack — if you already have some, keep whichever total is higher.",
      "meta": {
        "action": "Passive",
        "range": "5 ft"
      }
    }
  ]
}